{
  "schema_version": 1,
  "bank_id": "cape-loop-conversation-templates-v1",
  "source": "project-standardized-neutral-frame-v1-unreviewed",
  "templates": [
    {
      "scenario_id": "travel-scenario-atlas-itinerary-planning-01",
      "display_names": {
        "travel-atlas-itinerary-planning-01-negative": "Itinerary A",
        "travel-atlas-itinerary-planning-01-positive": "Itinerary B",
        "travel-atlas-itinerary-planning-01-negative-peer": "Itinerary C",
        "travel-atlas-itinerary-planning-01-positive-peer": "Itinerary D"
      },
      "presentation_templates": {
        "balanced": "{prompt} Here are the two choices. {option_1_name} is {option_1_description}. {option_2_name} is {option_2_description}. Which would you select?",
        "restricted": "{prompt} Here are the two choices. {option_1_name} is {option_1_description}. {option_2_name} is {option_2_description}. Which would you select?",
        "default": "{prompt} {default_name} is preselected as the default. Here are the two choices. {option_1_name} is {option_1_description}. {option_2_name} is {option_2_description}. Which would you select?",
        "suggested": "{prompt} I suggest {suggested_name}. Here are the two choices. {option_1_name} is {option_1_description}. {option_2_name} is {option_2_description}. Which would you select?",
        "ranking": "{prompt} Here are the two choices. {option_1_name} is {option_1_description}. {option_2_name} is {option_2_description}. Which would you select?"
      },
      "choice_template": "I choose {selected_name}.",
      "source": "project-standardized-neutral-frame-v1-unreviewed"
    },
    {
      "scenario_id": "travel-scenario-atlas-lodging-price-01",
      "display_names": {
        "travel-atlas-lodging-price-01-negative": "Lodging A",
        "travel-atlas-lodging-price-01-positive": "Lodging B",
        "travel-atlas-lodging-price-01-negative-peer": "Lodging C",
        "travel-atlas-lodging-price-01-positive-peer": "Lodging D"
      },
      "presentation_templates": {
        "balanced": "{prompt} The available choices are {option_1_name}: {option_1_description}; and {option_2_name}: {option_2_description}. Which would you choose?",
        "restricted": "{prompt} The available choices are {option_1_name}: {option_1_description}; and {option_2_name}: {option_2_description}. Which would you choose?",
        "default": "{prompt} {default_name} is preselected as the default. The available choices are {option_1_name}: {option_1_description}; and {option_2_name}: {option_2_description}. Which would you choose?",
        "suggested": "{prompt} I suggest {suggested_name}. The available choices are {option_1_name}: {option_1_description}; and {option_2_name}: {option_2_description}. Which would you choose?",
        "ranking": "{prompt} The available choices are {option_1_name}: {option_1_description}; and {option_2_name}: {option_2_description}. Which would you choose?"
      },
      "choice_template": "I choose {selected_name}.",
      "source": "project-standardized-neutral-frame-v1-unreviewed"
    },
    {
      "scenario_id": "travel-scenario-atlas-meeting-setting-01",
      "display_names": {
        "travel-atlas-meeting-setting-01-negative": "Room A",
        "travel-atlas-meeting-setting-01-positive": "Room B",
        "travel-atlas-meeting-setting-01-negative-peer": "Room C",
        "travel-atlas-meeting-setting-01-positive-peer": "Room D"
      },
      "presentation_templates": {
        "balanced": "{prompt} Please compare {option_1_name}, which is {option_1_description}, with {option_2_name}, which is {option_2_description}. Which option do you prefer?",
        "restricted": "{prompt} Please compare {option_1_name}, which is {option_1_description}, with {option_2_name}, which is {option_2_description}. Which option do you prefer?",
        "default": "{prompt} {default_name} is preselected as the default. Please compare {option_1_name}, which is {option_1_description}, with {option_2_name}, which is {option_2_description}. Which option do you prefer?",
        "suggested": "{prompt} I suggest {suggested_name}. Please compare {option_1_name}, which is {option_1_description}, with {option_2_name}, which is {option_2_description}. Which option do you prefer?",
        "ranking": "{prompt} Please compare {option_1_name}, which is {option_1_description}, with {option_2_name}, which is {option_2_description}. Which option do you prefer?"
      },
      "choice_template": "I choose {selected_name}.",
      "source": "project-standardized-neutral-frame-v1-unreviewed"
    },
    {
      "scenario_id": "travel-scenario-beacon-booking-planning-01",
      "display_names": {
        "travel-beacon-booking-planning-01-negative": "Journey Plan A",
        "travel-beacon-booking-planning-01-positive": "Journey Plan B",
        "travel-beacon-booking-planning-01-negative-peer": "Journey Plan C",
        "travel-beacon-booking-planning-01-positive-peer": "Journey Plan D"
      },
      "presentation_templates": {
        "balanced": "{prompt} Here are the two choices. {option_1_name} is {option_1_description}. {option_2_name} is {option_2_description}. Which would you select?",
        "restricted": "{prompt} Here are the two choices. {option_1_name} is {option_1_description}. {option_2_name} is {option_2_description}. Which would you select?",
        "default": "{prompt} {default_name} is preselected as the default. Here are the two choices. {option_1_name} is {option_1_description}. {option_2_name} is {option_2_description}. Which would you select?",
        "suggested": "{prompt} I suggest {suggested_name}. Here are the two choices. {option_1_name} is {option_1_description}. {option_2_name} is {option_2_description}. Which would you select?",
        "ranking": "{prompt} Here are the two choices. {option_1_name} is {option_1_description}. {option_2_name} is {option_2_description}. Which would you select?"
      },
      "choice_template": "I choose {selected_name}.",
      "source": "project-standardized-neutral-frame-v1-unreviewed"
    },
    {
      "scenario_id": "travel-scenario-beacon-dining-setting-01",
      "display_names": {
        "travel-beacon-dining-setting-01-negative": "Dining Room A",
        "travel-beacon-dining-setting-01-positive": "Dining Room B",
        "travel-beacon-dining-setting-01-negative-peer": "Dining Room C",
        "travel-beacon-dining-setting-01-positive-peer": "Dining Room D"
      },
      "presentation_templates": {
        "balanced": "{prompt} Please compare {option_1_name}, which is {option_1_description}, with {option_2_name}, which is {option_2_description}. Which option do you prefer?",
        "restricted": "{prompt} Please compare {option_1_name}, which is {option_1_description}, with {option_2_name}, which is {option_2_description}. Which option do you prefer?",
        "default": "{prompt} {default_name} is preselected as the default. Please compare {option_1_name}, which is {option_1_description}, with {option_2_name}, which is {option_2_description}. Which option do you prefer?",
        "suggested": "{prompt} I suggest {suggested_name}. Please compare {option_1_name}, which is {option_1_description}, with {option_2_name}, which is {option_2_description}. Which option do you prefer?",
        "ranking": "{prompt} Please compare {option_1_name}, which is {option_1_description}, with {option_2_name}, which is {option_2_description}. Which option do you prefer?"
      },
      "choice_template": "I choose {selected_name}.",
      "source": "project-standardized-neutral-frame-v1-unreviewed"
    },
    {
      "scenario_id": "travel-scenario-beacon-rail-price-01",
      "display_names": {
        "travel-beacon-rail-price-01-negative": "Rail Seat A",
        "travel-beacon-rail-price-01-positive": "Rail Seat B",
        "travel-beacon-rail-price-01-negative-peer": "Rail Seat C",
        "travel-beacon-rail-price-01-positive-peer": "Rail Seat D"
      },
      "presentation_templates": {
        "balanced": "{prompt} The available choices are {option_1_name}: {option_1_description}; and {option_2_name}: {option_2_description}. Which would you choose?",
        "restricted": "{prompt} The available choices are {option_1_name}: {option_1_description}; and {option_2_name}: {option_2_description}. Which would you choose?",
        "default": "{prompt} {default_name} is preselected as the default. The available choices are {option_1_name}: {option_1_description}; and {option_2_name}: {option_2_description}. Which would you choose?",
        "suggested": "{prompt} I suggest {suggested_name}. The available choices are {option_1_name}: {option_1_description}; and {option_2_name}: {option_2_description}. Which would you choose?",
        "ranking": "{prompt} The available choices are {option_1_name}: {option_1_description}; and {option_2_name}: {option_2_description}. Which would you choose?"
      },
      "choice_template": "I choose {selected_name}.",
      "source": "project-standardized-neutral-frame-v1-unreviewed"
    },
    {
      "scenario_id": "travel-scenario-cedar-activity-price-02",
      "display_names": {
        "travel-cedar-activity-price-02-negative": "Session A",
        "travel-cedar-activity-price-02-positive": "Session B",
        "travel-cedar-activity-price-02-negative-peer": "Session C",
        "travel-cedar-activity-price-02-positive-peer": "Session D"
      },
      "presentation_templates": {
        "balanced": "{prompt} The available choices are {option_1_name}: {option_1_description}; and {option_2_name}: {option_2_description}. Which would you choose?",
        "restricted": "{prompt} The available choices are {option_1_name}: {option_1_description}; and {option_2_name}: {option_2_description}. Which would you choose?",